<Voisins xmlns="http://www.univ-tlse3.fr/Services/Covoiturage"
	xmlns:xsi="http://www.w3.org/2001/XMLSchema-instance"
	xsi:schemaLocation="http://www.univ-tlse3.fr/Services/Covoiturage Covoiturage.xsd">
	<voisin>
		<personne>
			<nom>nom0</nom>
			<prenom>prenom0</prenom>
			<email>mail0@univ-tlse3.fr</email>
		</personne>
		<adresse>
			<numrue>65</numrue>
			<numpostal>31520</numpostal>
			<ville>Ramonville-Saint-Agne</ville>
			<rue>Avenue Tolosane</rue>
		</adresse>
		</voisin>
		<voisin>
		<personne>
			<nom>nom2</nom>
			<prenom>prenom2</prenom>
			<email>mail2@univ-tlse3.fr</email>
		</personne>
		<adresse>
			<numrue>141</numrue>
			<numpostal>31062</numpostal>
			<ville>Toulouse</ville>
			<rue>Avenue de Rangueil</rue>
		</adresse>
	</voisin>
</Voisins>